{"binding_type":"lifecycle_verifier_transaction","commit_marker":{"path":"reviews/.harness/verifier/terminal-m1/generation/commit-marker.json","root":"project","sha256":"1b1dc49c436d939e071943531c674b37f3f37adf10177d968e5580fed1bdc618"},"dispatch_claim":{"path":"reviews/.harness/assignment/dispatch/claims/dispatch-4fd39044190fe96a/claim.json","root":"project","sha256":"22afe484f2f0ca79482106e97e0c6bb901ab3bddbb1506565d3095bba3d7eb1b"},"dispatch_consumption":{"path":"reviews/.harness/assignment/dispatch/consumptions/consume-ce561a28401ceb56/consumption.json","root":"project","sha256":"80e1665e0ce24b5124ac918ffd3c7ebfb86bcc1099fb240dc0d1bc7e13face4e"},"generation_verifier_transaction_id":null,"phase":"generation","product_disposition":"evaluation_ready","publication_manifest":{"path":"reviews/.harness/verifier/terminal-m1/generation/publication-manifest.json","root":"project","sha256":"f6e04a25039d1fe0120f2b2ddac0138fb59da66454a672537058d120be00744b"},"receipt_id":"49927b27-a0f0-5659-91cd-abf47d780035","schema_version":"1.0.0","semantic_receipt":{"path":"reviews/.harness/fixtures/terminal-m1/semantic-execution-3.json","root":"project","sha256":"4de932b35916ba2ef67596ff025c9ea7dd0ca2de1b81c8e987baad91466f5a36"},"semantics_manifest":{"path":"references/semantics_manifest.v1.json","root":"harness","sha256":"bff0081411ade7e9230d9b8f3756d35b69b6df15bf1c01c2c300904f5ff79010"},"target":"research_notes/m1_deliverable.md","transaction":{"path":"reviews/.harness/verifier/terminal-m1/generation/verifier-transaction.json","root":"project","sha256":"4c6d6c0b42000502288bb875e06bc6b2bf9112a1b0a1ce959435cc2ab08fde08"},"wiki_root":{"manifest_sha256":"4221125abecf155091593d6686c6512d54dd0219e041cd0b6672675af9d009a2","path":"scripts/fixtures/assurance_provenance_c2/wiki","root":"harness"}}
