{"binding_type":"lifecycle_verifier_transaction","commit_marker":{"path":"reviews/.harness/verifier/terminal-m5/generation/commit-marker.json","root":"project","sha256":"a62e2dd70b984f3f993f155395044a0c4d1d54e70225cdbdd3e384a33db3ef5d"},"dispatch_claim":{"path":"reviews/.harness/assignment/dispatch/claims/dispatch-06eda12b2f5c023b/claim.json","root":"project","sha256":"31bff3110826655a52d208d39020972fa2ab69f1090142ab8809a217ba87339e"},"dispatch_consumption":{"path":"reviews/.harness/assignment/dispatch/consumptions/consume-41fd025386b5b87b/consumption.json","root":"project","sha256":"595ff21fd7d14de48bcdce254267d372d36a109ed36f6a8308ff7c0bc2a4ad38"},"generation_verifier_transaction_id":null,"phase":"generation","product_disposition":"evaluation_ready","publication_manifest":{"path":"reviews/.harness/verifier/terminal-m5/generation/publication-manifest.json","root":"project","sha256":"e6ccc434bff071c8ba4cccf5ddcc2e35ee888fa115958081a4738e2cf8dba60f"},"receipt_id":"a1c26c1f-e3e4-522e-b0ed-d4b3cb7b1742","schema_version":"1.0.0","semantic_receipt":{"path":"reviews/.harness/fixtures/terminal-m5/semantic-execution-3.json","root":"project","sha256":"5b0943f92f781c130269d8016ac48b94f92adce1be8ebc0b715a3eacb4341f5d"},"semantics_manifest":{"path":"references/semantics_manifest.v1.json","root":"harness","sha256":"bff0081411ade7e9230d9b8f3756d35b69b6df15bf1c01c2c300904f5ff79010"},"target":"research_notes/m5_deliverable.md","transaction":{"path":"reviews/.harness/verifier/terminal-m5/generation/verifier-transaction.json","root":"project","sha256":"71242b9ec0de74af7be5c8e53f72fef8c1d8f57a5dd923b5bfc627dbda2b4930"},"wiki_root":{"manifest_sha256":"4221125abecf155091593d6686c6512d54dd0219e041cd0b6672675af9d009a2","path":"scripts/fixtures/assurance_provenance_c2/wiki","root":"harness"}}
