{"binding_type":"lifecycle_verifier_transaction","commit_marker":{"path":"reviews/.harness/verifier/terminal-m2/generation/commit-marker.json","root":"project","sha256":"57fb36e64fb97bc89a73878983619a1e07201ff0d50d0deb993b841cc8ba1876"},"dispatch_claim":{"path":"reviews/.harness/assignment/dispatch/claims/dispatch-a93c578303bc8612/claim.json","root":"project","sha256":"f3a45d459338dfcf5b53fe99e2426b740c397ddf2edc59d78baf309fefb8a090"},"dispatch_consumption":{"path":"reviews/.harness/assignment/dispatch/consumptions/consume-b74e849b1fcb9e19/consumption.json","root":"project","sha256":"0197ad88a80ae3b45be12a8ea515cbbf6a3d62887dc2b01a5ce824a2ea177ed8"},"generation_verifier_transaction_id":null,"phase":"generation","product_disposition":"evaluation_ready","publication_manifest":{"path":"reviews/.harness/verifier/terminal-m2/generation/publication-manifest.json","root":"project","sha256":"5bc9d923a1b23befd5c00411bb04ba7b3ecbe7b1fecf8579a8fca4693c661e67"},"receipt_id":"2015e46e-331e-51e0-bacf-8b37960adff0","schema_version":"1.0.0","semantic_receipt":{"path":"reviews/.harness/fixtures/terminal-m2/semantic-execution-3.json","root":"project","sha256":"c464d2dfe896ad5252fcbf91d4aadfcedf3668bb5afd7e574071fa757d2fa600"},"semantics_manifest":{"path":"references/semantics_manifest.v1.json","root":"harness","sha256":"bff0081411ade7e9230d9b8f3756d35b69b6df15bf1c01c2c300904f5ff79010"},"target":"research_notes/m2_deliverable.md","transaction":{"path":"reviews/.harness/verifier/terminal-m2/generation/verifier-transaction.json","root":"project","sha256":"8a0fac61d6880787d820d0a41d2a552eeac675d2dc29d38da0ee5a15d8fe40e5"},"wiki_root":{"manifest_sha256":"4221125abecf155091593d6686c6512d54dd0219e041cd0b6672675af9d009a2","path":"scripts/fixtures/assurance_provenance_c2/wiki","root":"harness"}}
