{"binding_type":"lifecycle_verifier_transaction","commit_marker":{"path":"reviews/.harness/verifier/terminal-m3/evaluation-product/commit-marker.json","root":"project","sha256":"ec6f93fda925e8348d359d550cbc12e1e66afe4d1d34b30ed42de74bd3d244c1"},"dispatch_claim":{"path":"reviews/.harness/assignment/dispatch/claims/dispatch-55aec34095ea7968/claim.json","root":"project","sha256":"e95d2afbcff358d939ad8040d218175cfa9f21ba1291b159b4365a3977ca6091"},"dispatch_consumption":{"path":"reviews/.harness/assignment/dispatch/consumptions/consume-939a2237477d5e1c/consumption.json","root":"project","sha256":"621577c3de1e5c70e3949bdd7bd2943ab3b8d002334f6b9258f5c5516c714e86"},"generation_verifier_transaction_id":"verifier-a771c6ca1b5c555c","phase":"evaluation","product_disposition":"product_qualified","publication_manifest":{"path":"reviews/.harness/verifier/terminal-m3/evaluation-product/publication-manifest.json","root":"project","sha256":"2cbf54a744d23fe00d8b5a8d077166cc305eb178ad14c5971bfad79850f76e88"},"receipt_id":"23672b90-95f8-5051-b7cc-c750106db9b1","schema_version":"1.0.0","semantic_receipt":{"path":"reviews/.harness/verifier/terminal-m3/evaluation-semantic.json","root":"project","sha256":"549f066fb11df9e5a0ca54a94bcd2368e34e0fc90607c408f5f5e649ea2e6a35"},"semantics_manifest":{"path":"references/semantics_manifest.v1.json","root":"harness","sha256":"bff0081411ade7e9230d9b8f3756d35b69b6df15bf1c01c2c300904f5ff79010"},"target":"research_notes/m3_deliverable.md","transaction":{"path":"reviews/.harness/verifier/terminal-m3/evaluation-product/verifier-transaction.json","root":"project","sha256":"a1ee28fe3eb645ed881bf2391ae1dc4cea04145e3f9b445e0f8778783cf2a062"},"wiki_root":{"manifest_sha256":"4221125abecf155091593d6686c6512d54dd0219e041cd0b6672675af9d009a2","path":"scripts/fixtures/assurance_provenance_c2/wiki","root":"harness"}}
