{"binding_type":"lifecycle_verifier_transaction","commit_marker":{"path":"reviews/.harness/verifier/terminal-m5/evaluation-product/commit-marker.json","root":"project","sha256":"d00f8f491888938882cda3d57e49f506258ec2d14b48edc3a156eb76127d997d"},"dispatch_claim":{"path":"reviews/.harness/assignment/dispatch/claims/dispatch-57610fa53f89a7ca/claim.json","root":"project","sha256":"c27a492bec77f58bf4ec2033bfae886d54ff59c604a94ff64a0bcb2e96271a68"},"dispatch_consumption":{"path":"reviews/.harness/assignment/dispatch/consumptions/consume-576dc08f40391afe/consumption.json","root":"project","sha256":"dfb4afbe215daf10b2b0841d3ded16896c74251388583b681adfff5364c7b446"},"generation_verifier_transaction_id":"verifier-7f710bc1c750881e","phase":"evaluation","product_disposition":"product_qualified","publication_manifest":{"path":"reviews/.harness/verifier/terminal-m5/evaluation-product/publication-manifest.json","root":"project","sha256":"05032844836a4fc939dd08ca1826e767064667849f55f2ecb22a63e3bc232eef"},"receipt_id":"a1c26c1f-e3e4-522e-b0ed-d4b3cb7b1742","schema_version":"1.0.0","semantic_receipt":{"path":"reviews/.harness/verifier/terminal-m5/evaluation-semantic.json","root":"project","sha256":"cf6b74d120b34aaa70af9d2fe8119fae8e45bd6d81058141e0c44455c81751d9"},"semantics_manifest":{"path":"references/semantics_manifest.v1.json","root":"harness","sha256":"bff0081411ade7e9230d9b8f3756d35b69b6df15bf1c01c2c300904f5ff79010"},"target":"research_notes/m5_deliverable.md","transaction":{"path":"reviews/.harness/verifier/terminal-m5/evaluation-product/verifier-transaction.json","root":"project","sha256":"ce91e81e8b8a9577380ab40479d8eb2d5b2eb6e7bc19297575e9e7e8f1ffed45"},"wiki_root":{"manifest_sha256":"4221125abecf155091593d6686c6512d54dd0219e041cd0b6672675af9d009a2","path":"scripts/fixtures/assurance_provenance_c2/wiki","root":"harness"}}
