{"binding_type":"lifecycle_verifier_transaction","commit_marker":{"path":"reviews/.harness/verifier/terminal-m2/generation/commit-marker.json","root":"project","sha256":"ac61088e248366fd90ca8120133b97ca81e270a1a751b7ec63433f214e824313"},"dispatch_claim":{"path":"reviews/.harness/assignment/dispatch/claims/dispatch-a93c578303bc8612/claim.json","root":"project","sha256":"f3a45d459338dfcf5b53fe99e2426b740c397ddf2edc59d78baf309fefb8a090"},"dispatch_consumption":{"path":"reviews/.harness/assignment/dispatch/consumptions/consume-4da1f0d08f7a7f99/consumption.json","root":"project","sha256":"245cac0783e8651c256150be0b188973f248b3ca3d1722c6b90f2c17d62c1592"},"generation_verifier_transaction_id":null,"phase":"generation","product_disposition":"evaluation_ready","publication_manifest":{"path":"reviews/.harness/verifier/terminal-m2/generation/publication-manifest.json","root":"project","sha256":"2ad0ceed61e916693e4adfe6e8da296e9c872ba6ec03d7198136135110c4bafb"},"receipt_id":"2015e46e-331e-51e0-bacf-8b37960adff0","schema_version":"1.0.0","semantic_receipt":{"path":"reviews/.harness/fixtures/terminal-m2/semantic-execution-3.json","root":"project","sha256":"b77ffaedaa91fe11522168c5a4dc49d81c0b8507a9515004fa83e11aafee783c"},"semantics_manifest":{"path":"references/semantics_manifest.v1.json","root":"harness","sha256":"bff0081411ade7e9230d9b8f3756d35b69b6df15bf1c01c2c300904f5ff79010"},"target":"research_notes/m2_deliverable.md","transaction":{"path":"reviews/.harness/verifier/terminal-m2/generation/verifier-transaction.json","root":"project","sha256":"4663e7d978fd11ca671e520422328ac1f8ebbe96cc78f6d6e98fa223f21b9ea2"},"wiki_root":{"manifest_sha256":"4221125abecf155091593d6686c6512d54dd0219e041cd0b6672675af9d009a2","path":"scripts/fixtures/assurance_provenance_c2/wiki","root":"harness"}}
